"RELIC: Investigating Large Language Model Responses using Self-Consistency","Furui Cheng, Vilém Zouhar, Simran Arora, Mrinmaya Sachan, Hendrik Strobelt, Mennatallah El-Assady","CHI 2024","|PAPER:https://arxiv.org/abs/2311.16842","Large Language Models (LLMs) are notorious for blending fact with fiction and generating non-factual content, known as hallucinations. To tackle this challenge, we propose an interactive system that helps users obtain insights into the reliability of the generated text. Our approach is based on the idea that the self-consistency of multiple samples generated by the same LLM relates to its confidence in individual claims in the generated texts. Using this idea, we design RELIC, an interactive system that enables users to investigate and verify semantic-level variations in multiple long-form responses. This allows users to recognize potentially inaccurate information in the generated text and make necessary corrections. From a user study with ten participants, we demonstrate that our approach helps users better verify the reliability of the generated text. We further summarize the design implications and lessons learned from this research for inspiring future studies on reliable human-LLM interactions.","relic.png"
"WMT 2023 Shared Task on Machine Translation with Terminologies","Kirill Semenov, Vilém Zouhar, Tom Kocmi, Dongdong Zhang, Wangchunshu Zhou, Yuchen Eleanor Jiang","EMNLP 2023","|PAPER:https://aclanthology.org/2023.wmt-1.54/|DATA:https://github.com/wmt-terminology-task/data-2023|LINK:https://wmt-terminology-task.github.io/","The WMT 2023 Terminology Shared Task investigates progress in machine translation of texts with specialized vocabulary. The participants were given the source text and segment-level terminology dictionaries for three language pairs: Chinese→English, English→Czech, and German→English. We evaluate 21 submissions from 7 teams on two main criteria: general translation quality and the effectiveness of translating specialized terminology. Systems took varied approaches — incorporating terminology at inference time or weakly supervised training that uses terminology access. While incorporating terminology dictionaries leads to improvement in the translation quality, incorporating an equal amount of information from the reference leads to similar results. This challenges the position of terminologies being the crux of meaning in translation, it can also be explained by inadequate metrics which are not terminology-centric.","wmt23_terminology.png"
"A Diachronic Perspective on User Trust in AI under Uncertainty","Shehzaad Dhuliawala,<sup>=</sup> Vilém Zouhar,<sup>=</sup> Mennatallah El-Assady, Mrinmaya Sachan","EMNLP 2023","|PAPER:https://aclanthology.org/2023.emnlp-main.339/|CODE:https://github.com/zouharvi/trust-intervention/|DEMO:https://vilda.net/s/trust-intervention/?uid=demo_paper|VIDEO:https://www.youtube.com/watch?v=NrH3flpijDw","In human-AI collaboration, users typically form a mental model of the AI system, which captures the user’s beliefs about when the system performs well and when it does not. The construction of this mental model is guided by both the system’s veracity as well as the system output presented to the user e.g., the system’s confidence and an explanation for the prediction. However, modern NLP systems are seldom calibrated and are often confidently incorrect about their predictions, which violates users’ mental model and erodes their trust. In this work, we design a study where users bet on the correctness of an NLP system, and use it to study the evolution of user trust as a response to these trust-eroding events and how the user trust is rebuilt as a function of time after these events. We find that even a few highly inaccurate confidence estimation instances are enough to damage users’ trust in the system and performance, which does not easily recover over time. We further find that users are more forgiving to the NLP system if it is unconfidently correct rather than confidently incorrect, even though, from a game-theoretic perspective, their payoff is equivalent. Finally, we find that each user can entertain multiple mental models of the system based on the type of the question. These results highlight the importance of confidence calibration in developing user-centered NLP applications to avoid damaging user trust and compromising the collaboration performance.","trust_intervention.png"
"Enhancing Textbooks with Visuals from the Web for Improved Learning","Janvijay Singh, Vilém Zouhar, Mrinmaya Sachan","EMNLP 2023","|PAPER:https://aclanthology.org/2023.emnlp-main.731/|CODE:https://github.com/eth-nlped/textbook-enrichment|VIDEO:https://www.youtube.com/watch?v=zjKayShiBxc","Textbooks are one of the main mediums for delivering high-quality education to students. In particular, explanatory and illustrative visuals play a key role in retention, comprehension and general transfer of knowledge. However, many textbooks lack these interesting visuals to support student learning. In this paper, we investigate the effectiveness of vision-language models to automatically enhance textbooks with images from the web. We collect a dataset of e-textbooks in the math, science, social science and business domains. We then set up a text-image matching task that involves retrieving and appropriately assigning web images to textbooks, which we frame as a matching optimization problem. Through a crowd-sourced evaluation, we verify that (1) while the original textbook images are rated higher, automatically assigned ones are not far behind, and (2) the precise formulation of the optimization problem matters. We release the dataset of textbooks with an associated image bank to inspire further research in this intersectional area of computer vision and NLP for education.","textbook_enhancement.png"
"Re-visiting Automated Topic Model Evaluation with Large Language Models","Dominik Stammbach, Vilém Zouhar, Alexander Hoyle, Mrinmaya Sachan, Elliott Ash","EMNLP 2023","|PAPER:https://aclanthology.org/2023.emnlp-main.581/|VIDEO:https://www.youtube.com/watch?v=qIDjtgWTgjs|CODE:https://github.com/dominiksinsaarland/evaluating-topic-model-output","Topic models help us make sense of large text collections. Automatically evaluating their output and determining the optimal number of topics are both longstanding challenges, with no effective automated solutions to date. This paper proposes using large language models (LLMs) for these tasks. We find that LLMs appropriately assess the resulting topics, correlating more strongly with human judgments than existing automated metrics. However, the setup of the evaluation task is crucial — LLMs perform better on coherence ratings of word sets than on intrustion detection. We find that LLMs can also assist us in guiding us towards a reasonable number of topics. In actual applications, topic models are typically used to answer a research question related to a collection of texts. We can incorporate this research question in the prompt to the LLM, which helps estimating the optimal number of topics.","llm_topic_model_evaluation.png"
"Tokenization and the Noiseless Channel","Vilém Zouhar, Clara Meister, Juan Luis Gastaldi, Li Du, Mrinmaya Sachan, Ryan Cotterell","ACL 2023","|PAPER:https://aclanthology.org/2023.acl-long.284/|TOOL:https://github.com/zouharvi/tokenization-scorer|VIDEO:https://www.youtube.com/watch?v=rCBDcKD8UEg","Subword tokenization is a key part of most NLP pipelines. However, little is known about why some tokenizer and hyperparameter combinations lead to improved downstream model performance over others. We propose that good tokenizers lead to efficient channel usage, where the channel is the means by which some input is conveyed to the model and efficiency can be quantified in information-theoretic terms as the ratio of the Shannon entropy to the maximum entropy of the subword distribution. Nevertheless, an optimal encoding according to Shannon entropy assigns extremely long codes to low-frequency subwords and very short codes to high-frequency subwords.Defining efficiency in terms of Rényi entropy, on the other hand, penalizes distributions with either very high or very low-frequency subwords.We posit that (1) extremely high-frequency subwords are problematic because their meaning is not distinct and (2) that low-frequency subwords may not appear frequently enough for their meaning to be learned properly; encodings that induce unigram distributions with either can harm model performance. In machine translation, we find that across multiple tokenizers, the Rényi entropy has a very strong correlation with BLEU: 0.82 in comparison to just -0.30 for compressed length.","tokenization_principle.png"
"A Formal Perspective on Byte-Pair Encoding","Vilém Zouhar, Clara Meister, Juan Luis Gastaldi, Li Du, Tim Vieira, Mrinmaya Sachan, Ryan Cotterell","ACL 2023","|PAPER:https://aclanthology.org/2023.findings-acl.38/|CODE:https://github.com/zouharvi/formal-bpe|VIDEO:https://www.youtube.com/watch?v=aB7oaS0rlvI","Byte-Pair Encoding (BPE) is a popular algorithm used for tokenizing data in NLP, despite being devised initially as a compression method. BPE appears to be a greedy algorithm at face value, but the underlying optimization problem that BPE seeks to solve has not yet been laid down. We formalize BPE as a combinatorial optimization problem. Via submodular functions, we prove that the iterative greedy version is a 1/sigma*(1-e(-sigma))-approximation of an optimal merge sequence, where sigma is the total backward curvature with respect to the optimal merge sequence. Empirically the lower bound of the approximation is ~0.37.We provide a faster implementation of BPE which improves the runtime complexity from O(NM) to O(N log M), where N is the sequence length and M is the merge count. Finally, we optimize the brute-force algorithm for optimal BPE using memoization.","formal_bpe.png"
"Evaluating Optimal Reference Translations","Vilém Zouhar, Věra Kloudová, Martin Popel, Ondřej Bojar","JNLE, to appear 2024","|PAPER:https://arxiv.org/abs/2311.16787|CODE:https://github.com/ufal/optimal-reference-translations|DATA:https://github.com/ufal/optimal-reference-translations","The overall translation quality reached by current machine translation (MT) systems for high-resourced language pairs is remarkably good. Standard methods of evaluation are not suitable nor intended to uncover the many translation errors and quality deficiencies that still persist. Furthermore, the quality of standard reference translations is commonly questioned and comparable quality levels have been reached by MT alone in several language pairs. Navigating further research in these high-resource settings is thus difficult. In this article, we propose a methodology for creating more reliable document-level human reference translations, called 'optimal reference translations,' with the simple aim to raise the bar of what should be deemed 'human translation quality.' We evaluate the obtained document-level optimal reference translations in comparison with 'standard' ones, confirming a significant quality increase and also documenting the relationship between evaluation and translation editing.","ort.png"
"Navigating the Metrics Maze: Reconciling Score Magnitudes and Accuracies","Tom Kocmi, Vilém Zouhar, Christian Federmann, Matt Post","In review 2024","|PAPER:https://arxiv.org/abs/2401.06760|CODE:https://github.com/kocmitom/MT-Thresholds|DEMO:https://kocmitom.github.io/MT-Thresholds/|TOOL:https://pypi.org/project/mt-thresholds/","Ten years ago a single metric, BLEU, governed progress in machine translation research. For better or worse, there is no such consensus today, and consequently it is difficult for researchers to develop and retain the kinds of heuristic intuitions about metric deltas that drove earlier research and deployment decisions. This paper investigates the 'dynamic range' of a number of modern metrics in an effort to provide a collective understanding of the meaning of differences in scores both within and among metrics; in other words, we ask what point difference X in metric Y is required between two systems for humans to notice? We conduct our evaluation on a new large dataset, ToShip23, using it to discover deltas at which metrics achieve system-level differences that are meaningful to humans, which we measure by pairwise system accuracy. We additionally show that this method of establishing delta-accuracy is more stable than the standard use of statistical p-values in regards to testset size. Where data size permits, we also explore the effect of metric deltas and accuracy across finer-grained features such as translation direction, domain, and system closeness.","metrics_maze.png"
"Quality and Quantity of Machine Translation References for Automated Metrics","Vilém Zouhar, Ondřej Bojar","In review 2024","|PAPER:https://arxiv.org/abs/2401.01283|CODE:https://github.com/ufal/optimal-reference-translations","Automatic machine translation metrics often use human translations to determine the quality of system translations. Common wisdom in the field dictates that the human references should be of very high quality. However, there are no cost-benefit analyses that could be used to guide practitioners who plan to collect references for machine translation evaluation. We find that higher-quality references lead to better metric correlations with humans at the segment-level. Having up to 7 references per segment and taking their average helps all metrics. Interestingly, the references from vendors of different qualities can be mixed together and improve metric success. Higher quality references, however, cost more to create and we frame this as an optimization problem: given a specific budget, what references should be collected to maximize metric success. These findings can be used by evaluators of shared tasks when references need to be created under a certain budget.","ortmt.png"
"PWESuite: Phonetic Word Embeddings and Tasks They Facilitate","Vilém Zouhar, Kalvin Chang, Chenxuan Cui, Nathaniel Carlson, Nathaniel Robinson, Mrinmaya Sachan, David Mortensen","LREC-COLING 2024","|PAPER:https://arxiv.org/abs/2304.02541|CODE:https://github.com/zouharvi/pwesuite","Word embeddings that map words into a fixed-dimensional vector space are the backbone of modern NLP. Most word embedding methods encode semantic information. However, phonetic information, which is important for some tasks, is often overlooked. In this work, we develop several novel methods which leverage articulatory features to build phonetically informed word embeddings, and present a set of phonetic word embeddings to encourage their community development, evaluation and use. While several methods for learning phonetic word embeddings already exist, there is a lack of consistency in evaluating their effectiveness. Thus, we also proposes several ways to evaluate both intrinsic aspects of phonetic word embeddings, such as word retrieval and correlation with sound similarity, and extrinsic performances, such as rhyme and cognate detection and sound analogies. We hope that our suite of tasks will promote reproducibility and provide direction for future research on phonetic word embeddings.","pwesuite.png"
"Two Counterexamples to Tokenization and the Noiseless Channel","Marco Cognetta, Vilém Zouhar, Sangwhan Moon, Naoaki Okazaki","LREC-COLING 2024","|PAPER:https://arxiv.org/abs/2402.14614","In Tokenization and the Noiseless Channel, Rényi efficiency is suggested as an intrinsic mechanism for evaluating a tokenizer: for NLP tasks, the tokenizer which leads to the highest Rényi efficiency of the unigram distribution should be chosen. The Rényi efficiency is thus treated as a predictor of downstream performance (e.g., predicting BLEU for machine translation task), without the expensive step of training multiple models with different tokenizers. Although useful, the predictive power of this metric is not perfect, and the authors note there are additional qualities of a good tokenization scheme that Rényi efficiency alone cannot capture. We describe two variants of BPE tokenization which can arbitrarily increase Rényi efficiency while decreasing the downstream model performance. These counterexamples expose cases where Rényi efficiency fails as an intrinsic tokenization metric and thus give insight for building more accurate predictors.","tokenization_counter.png"
"Scaling the Authoring of AutoTutors with Large Language Models","Sankalan Pal Chowdhury, Vilém Zouhar, Mrinmaya Sachan","In review 2024","|PAPER:https://arxiv.org/abs/2402.09216","Large Language Models (LLMs) have found several use cases in education, ranging from automatic question generation to essay evaluation. In this paper, we explore the potential of using Large Language Models (LLMs) to author Intelligent Tutoring Systems. A common pitfall of LLMs is their straying from desired pedagogical strategies such as leaking the answer to the student, and in general, providing no guarantees. We posit that while LLMs with certain guardrails can take the place of subject experts, the overall pedagogical design still needs to be handcrafted for the best learning results. Based on this principle, we create a sample end-to-end tutoring system named MWPTutor, which uses LLMs to fill in the state space of a pre-defined finite state transducer. This approach retains the structure and the pedagogy of traditional tutoring systems that has been developed over the years by learning scientists but brings in additional flexibility of LLM-based approaches. Through a human evaluation study on two datasets based on math word problems, we show that our hybrid approach achieves a better overall tutoring score than an instructed, but otherwise free-form, GPT-4. MWPTutor is completely modular and opens up the scope for the community to improve its performance by improving individual modules or using different teaching strategies that it can follow.","mwptutor.png"
"Poor Man's Quality Estimation: Predicting Ref.-Based MT Metrics Without Reference","Vilém Zouhar, Shehzaad Dhuliawala, Wangchunshu Zhou, Nico Daheim, Tom Kocmi, Yuchen Eleanor Jiang, Mrinmaya Sachan","EACL 2023","|PAPER:https://aclanthology.org/2023.eacl-main.95/|CODE:https://github.com/zouharvi/mt-metric-estimation|VIDEO:https://www.youtube.com/watch?v=feMWDVylhac","Machine translation quality estimation (QE) predicts human judgements of a translation hypothesis without seeing the reference. State-of-the-art QE systems based on pretrained language models have been achieving remarkable correlations with human judgements yet they are computationally heavy and require human annotations, which are slow and expensive to create. To address these limitations, we define the problem of metric estimation (ME) where one predicts the automated metric scores also without the reference. We show that even without access to the reference, our model can estimate automated metrics (ρ = 60% for BLEU, ρ = 51% for other metrics) at the sentence-level. Because automated metrics correlate with human judgements, we can leverage the ME task for pre-training a QE model. For the QE task, we find that pre-training on TER is better (ρ = 23%) than training for scratch (ρ = 20%).","mt_metrics_estimation.png"
"Sentence Ambiguity, Grammaticality and Complexity Probes","Sunit Bhattacharya,<sup>=</sup> Vilém Zouhar,<sup>=</sup> Ondřej Bojar","BlackboxNLP 2022","|PAPER:https://aclanthology.org/2022.blackboxnlp-1.4/|CODE:https://github.com/ufal/ambiguity-grammaticality-complexity","It is unclear whether, how and where large pre-trained language models capture subtle linguistic traits like ambiguity, grammaticality and sentence complexity. We present results of automatic classification of these traits and compare their viability and patterns across representation types. We demonstrate that template-based datasets with surface-level artifacts should not be used for probing, careful comparisons with baselines should be done and that t-SNE plots should not be used to determine the presence of a feature among dense vectors representations. We also show how features might be highly localized in the layers for these models and get lost in the upper layers.","sentence_ambiguity.png"
"Shrinking Knowledge Base Size: Dimension Reduction, Splitting & Filtering","Vilém Zouhar","Master thesis 2022","|LINK:https://raw.githubusercontent.com/zouharvi/kb-shrink/main/meta/thesis/zouhar_thesis_lct.pdf|CODE:https://github.com/zouharvi/kb-shrink","ecently neural network based approaches to knowledge-intensive NLP tasks, such asquestion answering, started to rely heavily on the combination of neural retrievers andreaders. Retrieval is typically performed over a large textual knowledge base whichrequires significant memory and compute resources, especially when scaled up. OnHotpotQA we explore various filtering & splitting criteria. Primarily, we systematicallyinvestigate reducing the size of the KB index by means of dimensionality (sparse randomprojections, PCA, autoencoders) and numerical precision reduction.Our results show that PCA is an easy solution that requires very little data and is onlyslightly worse than autoencoders, which are less stable. All methods are sensitive to pre-and post-processing and data should always be centered and normalized both before andafter dimension reduction. Finally, we show that it is possible to combine PCA withusing 1bit per dimension. Overall we achieve (1) 100× compression with 75%, and (2)24× compression with 92% original retrieval performance.","kbshrink_thesis.png"
"Knowledge Base Index Compression via Dimensionality and Precision Reduction","Vilém Zouhar, Marius Mosbach, Miaoran Zhang, Dietrich Klakow","SpaNLP 2022","|PAPER:https://arxiv.org/pdf/2204.02906.pdf|CODE:https://github.com/zouharvi/kb-shrink|VIDEO:https://www.youtube.com/watch?v=qczabc2oyMA","Recently neural network based approaches to knowledge-intensive NLP tasks, such as question answering, started to rely heavily on the combination of neural retrievers and readers. Retrieval is typically performed over a large textual knowledge base (KB) which requires significant memory and compute resources, especially when scaled up. On HotpotQA we systematically investigate reducing the size of the KB index by means of dimensionality (sparse random projections, PCA, autoencoders) and numerical precision reduction. Our results show that PCA is an easy solution that requires very little data and is only slightly worse than autoencoders, which are less stable. All methods are sensitive to pre- and post-processing and data should always be centered and normalized both before and after dimension reduction. Finally, we show that it is possible to combine PCA with using 1bit per dimension. Overall we achieve (1) 100× compression with 75%, and (2) 24× compression with 92% original retrieval performance.","kbshrink_paper.png"
"Neural Machine Translation Quality and Post-Editing Performance","Vilém Zouhar, Ondřej Bojar, Martin Popel, Aleš Tamchyna","EMNLP 2021","|PAPER:https://aclanthology.org/2021.emnlp-main.801/|CODE:https://github.com/ufal/nmt-pe-effects-2021|VIDEO:https://www.youtube.com/watch?v=rCuoUbmJ5Uk","We test the natural expectation that using MT in professional translation saves human processing time. The last such study was carried out by Sanchez-Torron and Koehn (2016) with phrase-based MT, artificially reducing the translation quality. In contrast, we focus on neural MT (NMT) of high quality, which has become the state-of-the-art approach since then and also got adopted by most translation companies. Through an experimental study involving over 30 professional translators for English -> Czech translation, we examine the relationship between NMT performance and post-editing time and quality. Across all models, we found that better MT systems indeed lead to fewer changes in the sentences in this industry setting. The relation between system quality and post-editing time is however not straightforward and, contrary to the results on phrase-based MT, BLEU is definitely not a stable predictor of the time or final output quality.","nmtpe.png"
"Providing Backtranslation Improves Users Confidence in MT, Not Quality","V. Zouhar, M. Novák, M. Žilinec, O. Bojar, M. Obregón, R. L. Hill, F. Blain, M. Fomicheva, L. Specia, L. Yankovskaya","NAACL 2021","|PAPER:https://aclanthology.org/2021.naacl-main.14/|CODE:https://github.com/zouharvi/ptakopet|VIDEO:https://www.youtube.com/watch?v=9V7VSYspdtQ","Translating text into a language unknown to the text’s author, dubbed outbound translation, is a modern need for which the user experience has significant room for improvement, beyond the basic machine translation facility. We demonstrate this by showing three ways in which user confidence in the outbound translation, as well as its overall final quality, can be affected: backward translation, quality estimation (with alignment) and source paraphrasing. In this paper, we describe an experiment on outbound translation from English to Czech and Estonian. We examine the effects of each proposed feedback module and further focus on how the quality of machine translation systems influence these findings and the user perception of success. We show that backward translation feedback has a mixed effect on the whole process: it increases user confidence in the produced translation, but not the objective quality.","providing_backtranslation.png"
