"Artefact Retrieval: Overview of NLP Models with Knowledge Base Access","Vilém Zouhar, Marius Mosbach, Debanjali Biswas, Dietrich Klakow","AKBC CSKB 2021","|PAPER:https://openreview.net/forum?id=9_oCNR6R9l2","Many NLP models gain performance by having access to a knowledge base. A lot of research has been devoted to devising and improving the way the knowledge base is accessed and incorporated into the model, resulting in a number of mechanisms and pipelines. Despite the diversity of proposed mechanisms, there are patterns in the designs of such systems. In this paper, we systematically describe the typology of *artefacts* (items retrieved from a knowledge base), retrieval mechanisms and the way these artefacts are *fused* into the model. This further allows us to uncover combinations of design decisions that had not yet been tried. Most of the focus is given to language models, though we also show how question answering, fact-checking and knowledgable dialogue models fit into this system as well. Having an abstract model which can describe the architecture of specific models also helps with transferring these architectures between multiple NLP tasks.","artefact_retrieval.png"
"Sampling and Filtering of Neural Machine Translation Distillation Data","Vilém Zouhar","NAACL SRW 2021","|PAPER:https://aclanthology.org/2021.naacl-srw.1/|CODE:https://github.com/zouharvi/reference-mt-distill","In most of neural machine translation distillation or stealing scenarios, the highest-scoring hypothesis of the target model (teacher) is used to train a new model (student). If reference translations are also available, then better hypotheses (with respect to the references) can be oversampled and poor hypotheses either removed or undersampled. This paper explores the sampling method landscape (pruning, hypothesis oversampling and undersampling, deduplication and their combination) with English to Czech and English to German MT models using standard MT evaluation metrics. We show that careful oversampling and combination with the original data leads to better performance when compared to training only on the original or synthesized data or their direct combination.","mt_filtering.png"
"Leveraging Neural Machine Translation for Word Alignment","Vilém Zouhar, Daria Pylypenko","PBML 116","|PAPER:https://ufal.mff.cuni.cz/pbml/116/art-zouhar-pylypenko.pdf|CODE:https://github.com/zouharvi/LeverageAlign","The most common tools for word-alignment rely on a large amount of parallel sentences,which are then usually processed according to one of the IBM model algorithms. The trainingdata is, however, the same as for machine translation (MT) systems, especially for neural MT(NMT), which itself is able to produce word-alignments using the trained attention heads. Thisis convenient because word-alignment is theoretically a viable byproduct of any attention-basedNMT, which is also able to provide decoder scores for a translated sentence pair.We summarize different approaches on how word-alignment can be extracted from align-ment scores and then explore ways in which scores can be extracted from NMT, focusing oninferring the word-alignment scores based on output sentence and token probabilities. Wecompare this to the extraction of alignment scores from attention. We conclude with aggregat-ing all of the sources of alignment scores into a simple feed-forward network which achievesthe best results when combined alignment extractors are used.","leverage_align.png"
"WMT20 Document-Level Markable Error Exploration","Vilém Zouhar, Tereza Vojtěchová, Ondřej Bojar","WMT 2020","|PAPER:https://aclanthology.org/2020.wmt-1.41/|CODE:https://github.com/ELITR/wmt20-elitr-testsuite","Even though sentence-centric metrics are used widely in machine translation evaluation, document-level performance is at least equally important for professional usage. In this paper, we bring attention to detailed document-level evaluation focused on markables (expressions bearing most of the document meaning) and the negative impact of various markable error phenomena on the translation. For an annotation experiment of two phases, we chose Czech and English documents translated by systems submitted to WMT20 News Translation Task. These documents are from the News, Audit and Lease domains. We show that the quality and also the kind of errors varies significantly among the domains. This systematic variance is in contrast to the automatic evaluation results. We inspect which specific markables are problematic for MT systems and conclude with an analysis of the effect of markable error types on the MT performance measured by humans and automatic evaluation tools.","wmt20_markable.png"
"Extending Ptakopět for MT User Interaction Experiments","Vilém Zouhar, Michal Novák","PBML 115","|PAPER:https://ufal.mff.cuni.cz/pbml/115/art-zouhar-novak.pdf|CODE:https://github.com/zouharvi/ptakopet","The problems of outbound translation, machine translation user confidence and user inter-action are not yet fully explored. The goal of the online modular system Ptakopět is to providetools for studying these phenomena. Ptakopět is a proof-of-concept system for examining userinteraction with enhanced machine translation. It can be used either for actual translation orrunning experiments on human annotators. In this article, we aim to describe its main com-ponents and to show how to use Ptakopět for further research. We also share tips for runningexperiments and setting up a similar online annotation environment.Ptakopět was already used for outbound machine translation experiments, and we cover theresults of the latest experiment in a demonstration to show the research potential of this tool.We show quantitatively that even though backward translation improves machine-translationuser experience, it mainly increases users’ confidence and not the translation quality.","extending_ptakopet.png"
"Outbound Translation User Interface Ptakopět: A Pilot Study","Vilém Zouhar, Ondřej Bojar","LREC 2020","|PAPER:https://aclanthology.org/2020.lrec-1.860/|CODE:https://github.com/zouharvi/ptakopet","It is not uncommon for Internet users to have to produce a text in a foreign language they have very little knowledge of and are unable to verify the translation quality. We call the task “outbound translation” and explore it by introducing an open-source modular system Ptakopět. Its main purpose is to inspect human interaction with MT systems enhanced with additional subsystems, such as backward translation and quality estimation. We follow up with an experiment on (Czech) human annotators tasked to produce questions in a language they do not speak (German), with the help of Ptakopět. We focus on three real-world use cases (communication with IT support, describing administrative issues and asking encyclopedic questions) from which we gain insight into different strategies users take when faced with outbound translation tasks. Round trip translation is known to be unreliable for evaluating MT systems but our experimental evaluation documents that it works very well for users, at least on MT systems of mid-range quality.","ptakopet_paper.png"
"Enabling Outbound Machine Translation","Vilém Zouhar","Bachelor thesis 2020","|LINK:https://dspace.cuni.cz/bitstream/handle/20.500.11956/119400/130284419.pdf?sequence=1|CODE:https://github.com/zouharvi/ptakopet","It is not uncommon for Internet users to have to produce text in aforeign language they have very little knowledge of and are unable to verify thetranslation quality. We call the task “outbound translation” and explore it byintroducing an open-source modular system Ptakopět. Its main purpose is toinspect human interaction with machine translation systems enhanced by ad-ditional subsystems, such as backward translation and quality estimation. Wefollow up with an experiment on (Czech) human annotators tasked to producequestions in a language they do not speak (German), with the help of Ptakopět.We focus on three real-world use cases (communication with IT support, describ-ing administrative issues and asking encyclopedic questions) from which we gaininsight into different strategies users take when faced with outbound translationtasks. Round trip translation is known to be unreliable for evaluating MT sys-tems but our experimental evaluation documents that it works very well for users,at least on MT systems of mid-range quality.","ptakopet_thesis.png"